{
  "schema_version": "1.0",
  "agent": {
    "name": "reviewer",
    "kind": "native",
    "runtime_agent": "unknown"
  },
  "intent": {
    "purpose": "Review the diff for task 1.1."
  },
  "allow": {
    "tools": [],
    "read_paths": [],
    "write_paths": [],
    "hosts": [],
    "commands": []
  },
  "deny": {
    "commands": [],
    "paths": [],
    "hosts": []
  },
  "budget": {},
  "approvals": []
}
