{
  "schema_version": "1.0",
  "agent": {
    "name": "implementer worker 2",
    "kind": "delegated-cli",
    "runtime_agent": "claude-code",
    "provider": "anthropic",
    "model": {
      "vendor": "anthropic",
      "family": "claude",
      "version": "5"
    },
    "harness_version": "2.67.0"
  },
  "parent_lease_id": "0f9b7c1e-4a2d-4c6e-9b1f-2d3e4f5a6b7c",
  "intent": {
    "spec_slug": "demo",
    "task_id": "1.1",
    "purpose": "Implement task 1.1 of demo within its file scope."
  },
  "allow": {
    "tools": [
      "cdf_write_artefact",
      "cdf_update_task_status",
      "cdf_record_provenance"
    ],
    "read_paths": [
      "**",
      "./docs/**",
      "src/./lib/**",
      "%2e%2e/not-traversal/**"
    ],
    "write_paths": [
      "src/demo/**",
      "test/unit/demo*.test.ts"
    ],
    "hosts": [
      "api.anthropic.com"
    ],
    "commands": [
      "claude"
    ]
  },
  "deny": {
    "commands": [
      "sudo",
      "su",
      "docker",
      "ssh",
      "curl",
      "wget",
      "launchctl",
      "systemctl"
    ],
    "paths": [
      ".cdf/audit/**",
      ".cdf/runtime/**",
      ".env",
      "~/.ssh/**",
      "~/.aws/**"
    ],
    "hosts": [
      "*.internal.example"
    ]
  },
  "budget": {
    "steps": 200,
    "wall_clock_ms": 900000,
    "tokens": 400000,
    "cost_usd": 4.5,
    "depth": 1,
    "fan_out": 0
  },
  "approvals": [
    "external.write",
    "phase.advance"
  ],
  "attestation": {
    "issuer": "bridge",
    "signature": "9f2c4b7a1e3d5c6b8a0f1e2d3c4b5a69788796a5b4c3d2e1f0a9b8c7d6e5f4a3",
    "key_fingerprint": "sha256:3b1f0e"
  }
}
